{
  "protocol": "coworld-improvement-v1",
  "corpus_path": "/home/ubuntu/repos/coworld-mtg/cases/corpus/corpus.json",
  "corpus_sha256": "8b7151e61d99082ba22c39ee5dc56e798e339e44387af5834f6b3c1982dfbb3c",
  "scenario": {
    "seed": 42,
    "life": [
      20,
      20
    ],
    "mana": [
      [
        "white"
      ],
      []
    ],
    "cards": [
      {
        "label": "swords",
        "name": "Swords to Plowshares",
        "owner": "player",
        "zone": "hand",
        "tapped": false,
        "plus_one_counters": 0
      },
      {
        "label": "bear",
        "name": "Grizzly Bears",
        "owner": "opponent",
        "zone": "battlefield",
        "tapped": false,
        "plus_one_counters": 3
      }
    ],
    "operations": [
      {
        "kind": "cast",
        "card": "swords",
        "targets": [
          {
            "kind": "object",
            "label": "bear"
          }
        ],
        "finish": "resolve",
        "x": null
      }
    ]
  }
}
